{
  "schemaVersion": 1,
  "id": "bobocloud.ai-agent",
  "publisher": "bobocloud",
  "name": "ai-agent",
  "summary": {
    "displayName": {
      "en": "BOBOCLOUD AI Agent",
      "zh-CN": "BOBOCLOUD AI Agent",
      "ja": "BOBOCLOUD AI Agent"
    },
    "description": {
      "en": "Official local workspace Agent with slash-command modes, Skills, five reasoning levels, access policies, and context compaction.",
      "zh-CN": "官方本地工作区 Agent，支持斜杠命令模式、Skills、五档思考强度、访问策略与上下文压缩。",
      "ja": "スラッシュコマンドのモード、Skills、5段階の推論強度、アクセス方針、コンテキスト圧縮に対応する公式ローカルワークスペース Agent です。"
    },
    "categories": [
      "ai",
      "developer-tools"
    ]
  },
  "latest": "1.3.0",
  "versions": {
    "1.0.0": {
      "path": "packages/bobocloud/ai-agent/versions/1.0.0.json",
      "sha256": "1c400e30b0d34ad3f2e9bb1d5e3658915cd678213abd4973c1c47c68a0de5917"
    },
    "1.1.0": {
      "path": "packages/bobocloud/ai-agent/versions/1.1.0.json",
      "sha256": "fe5348550aac295190ae43a1700d4386123b82b1440e01bc6ba35d65bc82f7b2"
    },
    "1.2.0": {
      "path": "packages/bobocloud/ai-agent/versions/1.2.0.json",
      "sha256": "e1e2550ef822418266ab030f30e9971695ed7b24b7565a4797ac3f4383bfd980"
    },
    "1.3.0": {
      "path": "packages/bobocloud/ai-agent/versions/1.3.0.json",
      "sha256": "57cd2fd4bb9f1d2c9c70b1cf527108073cd1a2b2565ec75a8206c9fab2aa7eeb"
    }
  }
}
